":START_ID",":END_ID","relation","concepts","synsets",":TYPE"
"People listed as responsible will be contacted periodically by Craig & Ingo for updates (certainly on the date listed, if not before!)","Ingo","is participated by","['host', 'feature', 'have', 'sponsor']","[]","Relation"
"Dave: how do I understand a watching brief?","Dave","is participated by","['host', 'feature', 'have', 'sponsor']","[]","Relation"
"Bob volunteers for electrical tests","Bob","is participated by","['host', 'feature', 'have', 'sponsor']","[]","Relation"
"Site Qualification Survey (Karola) - No questions","Karola","is participated by","['host', 'feature', 'have', 'sponsor']","[]","Relation"
"FMC-DP Status (Craig) - Send email to Craig if you need a “multi module to nexys” card (aka FMC-DP) by ITk week or afterwards","Craig","is participated by","['host', 'feature', 'have', 'sponsor']","[]","Relation"
"1. Send site quali document email (Karola)","Karola","is participated by","['host', 'feature', 'have', 'sponsor']","[]","Relation"
"Craig & Ingo","ITk week session","comment","['offer opinions', 'share thoughts', 'give feedback']","[]","Relation"
"Karola","shipping box survey","present","['appear', 'show up', 'be there', 'exist']","[]","Relation"
"Bart","Tony W","discuss","['talk', 'deliberate', 'debate', 'converse']","[]","Relation"
"Sven","Prototype HV tab holder","question","['query', 'inquire', 'interrogate', 'ask', 'probe']","[]","Relation"
"Sven","test coupon design","copy","['reproduce', 'duplicate', 'replicate', 'imitate', 'mirror']","[]","Relation"
"Dennis","Kambiz","inform","['disclose', 'share', 'enlighten', 'notify', 'advise']","[]","Relation"
"Sarah & Kunlin","mechanical hybrids","order","['sequence', 'arrange', 'organize', 'rank']","[]","Relation"
"Dennis","0.25mm core","check","['inspect', 'examine', 'test', 'verify']","[]","Relation"
"Jane","UV glue","test","['try', 'evaluate', 'examine']","[]","Relation"
"Dennis & Marc","EC Tabs","consider","['think', 'ponder', 'regard', 'analyze', 'view']","[]","Relation"
"Craig & Ingo","ITk week presenters","email","['contact', 'communicate', 'send', 'message']","[]","Relation"
"The minutes of the Strip Module Meeting were recorded on 28/01/20.","Actions were carried over from the meeting, including writing a QC document for coils.","because","['owing to', 'thanks to', 'as a result of', 'due to']","[]","Relation"
"Craig and Ingo will contact the people listed as responsible periodically for updates.","Updates could be verbal, email, or slides in a meeting.","at the same time","['happen together', 'coexist', 'overlap', 'coincide', 'synchronize']","[]","Relation"
"Craig and Ingo introduced the meeting.","A comment was made to move weighing and bonding later in the ITk week session.","after","['later', 'afterwards', 'next', 'afterward', 'follow']","[]","Relation"
"A shipping box survey was conducted.","A question was raised on whether the survey referred to all shipping options.","after","['later', 'afterwards', 'next', 'afterward', 'follow']","[]","Relation"
"A prototype HV tab holder was discussed.","It was useful to save time.","because","['owing to', 'thanks to', 'as a result of', 'due to']","[]","Relation"
"Vitaliy commented that a prototype HV tab holder was useful.","The prototype HV tab holder was discussed.","at the same time","['happen together', 'coexist', 'overlap', 'coincide', 'synchronize']","[]","Relation"
"Test coupon measurements were taken.","It was confirmed that ASIC lands on test coupons identical to hybrids.","after","['later', 'afterwards', 'next', 'afterward', 'follow']","[]","Relation"
"It was confirmed that ASIC lands on test coupons identical to hybrids.","Metal trace variability should not affect shield layer functionality.","because","['owing to', 'thanks to', 'as a result of', 'due to']","[]","Relation"
"It was confirmed that metal trace variability should not affect shield layer functionality.","Via chain will remain.","because","['owing to', 'thanks to', 'as a result of', 'due to']","[]","Relation"
"It was confirmed that via chain will remain.","The EC is using the same test coupon.","because","['owing to', 'thanks to', 'as a result of', 'due to']","[]","Relation"
"Kambiz copied the design of the test coupon as far as Sven knows.","The EC is using the same test coupon.","at the same time","['happen together', 'coexist', 'overlap', 'coincide', 'synchronize']","[]","Relation"
"Dennis will make Kambiz aware of the change proposal.","A change proposal was discussed regarding the test coupon.","after","['later', 'afterwards', 'next', 'afterward', 'follow']","[]","Relation"
"Mechanical endcap hybrids were discussed.","It was confirmed that a 0.25mm core is okay.","after","['later', 'afterwards', 'next', 'afterward', 'follow']","[]","Relation"
"A 0.25mm core was confirmed to be okay.","The tender process is not yet complete.","because","['owing to', 'thanks to', 'as a result of', 'due to']","[]","Relation"
"Prague wants to order more mechanical hybrids.","Mechanical endcap hybrids were discussed.","after","['later', 'afterwards', 'next', 'afterward', 'follow']","[]","Relation"
"Ordering of mechanical hybrids is not yet closed.","Prague wants to order more mechanical hybrids.","because","['owing to', 'thanks to', 'as a result of', 'due to']","[]","Relation"
"Karola will add a link to the google sheet to the EC planning meeting agenda.","Prague wants to order more mechanical hybrids.","after","['later', 'afterwards', 'next', 'afterward', 'follow']","[]","Relation"
"A UV and polaris epoxy temperature dependence study was conducted.","It was confirmed that temperature-dependent calibration has been done.","after","['later', 'afterwards', 'next', 'afterward', 'follow']","[]","Relation"
"Temperature-dependent calibration has been done.","The study was conducted.","because","['owing to', 'thanks to', 'as a result of', 'due to']","[]","Relation"
"A stencil might be more reliable for the UV and polaris epoxy study.","It was confirmed that a stencil might be more reliable.","at the same time","['happen together', 'coexist', 'overlap', 'coincide', 'synchronize']","[]","Relation"
"It was determined that glue amounts should be checked by weight.","A question was raised on how to check glue amounts.","after","['later', 'afterwards', 'next', 'afterward', 'follow']","[]","Relation"
"Tests for the UV and polaris epoxy temperature dependence were done without hardener.","A study was conducted on the temperature dependence of UV glue.","at the same time","['happen together', 'coexist', 'overlap', 'coincide', 'synchronize']","[]","Relation"
"The EC HV tab jig was discussed.","A proposal was made to move all EC tabs to 5mm longer.","after","['later', 'afterwards', 'next', 'afterward', 'follow']","[]","Relation"
"It was decided not to move all EC tabs to 5mm longer.","There would be knock-on effects in the cold box design.","because","['owing to', 'thanks to', 'as a result of', 'due to']","[]","Relation"
"Forest added an additional talk about wire bonding.","Items were left for discussion, including wire bonding.","after","['later', 'afterwards', 'next', 'afterward', 'follow']","[]","Relation"
"Craig and Ingo will email the ITk week presenters and upload the minutes to indico.","The minutes of the meeting were recorded on 28/01/20.","after","['later', 'afterwards', 'next', 'afterward', 'follow']","[]","Relation"
"Writing a QC document for coils was assigned as an action.","The minutes of the meeting were recorded on 28/01/20.","after","['later', 'afterwards', 'next', 'afterward', 'follow']","[]","Relation"
"Craig and Ingo will email the ITk week presenters and upload the minutes to indico.","Writing a QC document for coils was assigned as an action.","at the same time","['happen together', 'coexist', 'overlap', 'coincide', 'synchronize']","[]","Relation"
"Craig & Ingo introduced the meeting.","Craig","is participated by","['host', 'feature', 'have', 'sponsor']","[]","Relation"
"Craig & Ingo introduced the meeting.","Ingo","is participated by","['host', 'feature', 'have', 'sponsor']","[]","Relation"
"Craig & Ingo suggested moving weighing and bonding to a later session.","Craig","is participated by","['host', 'feature', 'have', 'sponsor']","[]","Relation"
"Craig & Ingo suggested moving weighing and bonding to a later session.","Ingo","is participated by","['host', 'feature', 'have', 'sponsor']","[]","Relation"
"Karola asked about the shipping box survey.","Karola","is participated by","['host', 'feature', 'have', 'sponsor']","[]","Relation"
"Bart showed the prototype HV tab holder.","Bart","is participated by","['host', 'feature', 'have', 'sponsor']","[]","Relation"
"Vitaliy commented on the usefulness of the HV tab holder.","Vitaliy","is participated by","['host', 'feature', 'have', 'sponsor']","[]","Relation"
"Sven questioned the test coupon measurements.","Sven","is participated by","['host', 'feature', 'have', 'sponsor']","[]","Relation"
"Sven clarified the ASIC lands on test coupons.","Sven","is participated by","['host', 'feature', 'have', 'sponsor']","[]","Relation"
"Dennis confirmed the metal trace variability.","Dennis","is participated by","['host', 'feature', 'have', 'sponsor']","[]","Relation"
"Kambiz was informed about the change proposal.","Kambiz","is participated by","['host', 'feature', 'have', 'sponsor']","[]","Relation"
"Kambiz was informed about the change proposal.","Dennis","is participated by","['host', 'feature', 'have', 'sponsor']","[]","Relation"
"Sarah & Kunlin discussed mechanical endcap hybrids.","Sarah","is participated by","['host', 'feature', 'have', 'sponsor']","[]","Relation"
"Sarah & Kunlin discussed mechanical endcap hybrids.","Kunlin","is participated by","['host', 'feature', 'have', 'sponsor']","[]","Relation"
"Sarah & Kunlin discussed mechanical endcap hybrids.","Dennis","is participated by","['host', 'feature', 'have', 'sponsor']","[]","Relation"
"Dennis confirmed the core thickness.","Dennis","is participated by","['host', 'feature', 'have', 'sponsor']","[]","Relation"
"Prague wanted to order more mechanical hybrids.","Prague","is participated by","['host', 'feature', 'have', 'sponsor']","[]","Relation"
"Prague wanted to order more mechanical hybrids.","Karo","is participated by","['host', 'feature', 'have', 'sponsor']","[]","Relation"
"Jane presented the UV and polaris epoxy temperature dependence.","Jane","is participated by","['host', 'feature', 'have', 'sponsor']","[]","Relation"
"Jane commented on the stencil reliability.","Jane","is participated by","['host', 'feature', 'have', 'sponsor']","[]","Relation"
"Dennis & Marc discussed the EC HV tab jig.","Dennis","is participated by","['host', 'feature', 'have', 'sponsor']","[]","Relation"
"Dennis & Marc discussed the EC HV tab jig.","Marc","is participated by","['host', 'feature', 'have', 'sponsor']","[]","Relation"
"Dennis suggested moving all EC Tabs to 5mm longer.","Dennis","is participated by","['host', 'feature', 'have', 'sponsor']","[]","Relation"
"Forest added a talk about wire bonding.","Forest","is participated by","['host', 'feature', 'have', 'sponsor']","[]","Relation"
"Craig & Ingo were responsible for emailing ITk week presenters and uploading to indico.","Craig","is participated by","['host', 'feature', 'have', 'sponsor']","[]","Relation"
"Craig & Ingo were responsible for emailing ITk week presenters and uploading to indico.","Ingo","is participated by","['host', 'feature', 'have', 'sponsor']","[]","Relation"
"Timon, Carl, and Satish were responsible for writing the QC document for coils.","Timon","is participated by","['host', 'feature', 'have', 'sponsor']","[]","Relation"
"Timon, Carl, and Satish were responsible for writing the QC document for coils.","Carl","is participated by","['host', 'feature', 'have', 'sponsor']","[]","Relation"
"Timon, Carl, and Satish were responsible for writing the QC document for coils.","Satish","is participated by","['host', 'feature', 'have', 'sponsor']","[]","Relation"
"Strip Module Meeting","actions","carried","['moved', 'brought', 'carried', 'held', 'bore', 'transported']","[]","Relation"
"HV tab bonding","update","expected","['anticipated', 'forecasted', 'predicted', 'supposed', 'projected', 'hoped for']","[]","Relation"
"Hybrid crate roll-out","update","expected","['anticipated', 'forecasted', 'predicted', 'supposed', 'projected', 'hoped for']","[]","Relation"
"Module thermal cycling roll-out","update","expected","['anticipated', 'forecasted', 'predicted', 'supposed', 'projected', 'hoped for']","[]","Relation"
"Powerboard mass tester roll-out","update","expected","['anticipated', 'forecasted', 'predicted', 'supposed', 'projected', 'hoped for']","[]","Relation"
"Barrel hybrid tendering","actions","carried","['moved', 'brought', 'carried', 'held', 'bore', 'transported']","[]","Relation"
"Barrel powerboard tendering","actions","carried","['moved', 'brought', 'carried', 'held', 'bore', 'transported']","[]","Relation"
"EC hybrid/powerboard tendering","actions","carried","['moved', 'brought', 'carried', 'held', 'bore', 'transported']","[]","Relation"
"EC tooling design/roll-out","update","expected","['anticipated', 'forecasted', 'predicted', 'supposed', 'projected', 'hoped for']","[]","Relation"
"Barrel tooling design finalisation/roll-out","update","expected","['anticipated', 'forecasted', 'predicted', 'supposed', 'projected', 'hoped for']","[]","Relation"
"DCDC coils","specs","defined","['describe', 'specify', 'characterize', 'delineate', 'define']","[]","Relation"
"QC boundaries","powerboard performance","acceptable","['acceptable', 'tolerable', 'suitable', 'permissible', 'valid']","[]","Relation"
"powerboard performance","ATLAS performance specs","led","['guided', 'headed', 'steered', 'directed', 'managed']","[]","Relation"
"wire","specs","defined","['describe', 'specify', 'characterize', 'delineate', 'define']","[]","Relation"
"samples","coils","tested","['analyzed', 'examined', 'assessed', 'evaluated']","[]","Relation"
"production","quantity","evaluated","['reviewed', 'judged', 'assessed', 'rated', 'critiqued']","[]","Relation"
"quantity","EC 10,000","evaluated","['reviewed', 'judged', 'assessed', 'rated', 'critiqued']","[]","Relation"
"overhead","barrel","different","['vary', 'change', 'divergence', 'contrast', 'disparity']","[]","Relation"
"Barrel module frame","hybrid panel","finalised","['completed', 'finalized', 'settled', 'finished', 'concluded']","[]","Relation"
"module transport frame","clearance","okay","['agree', 'affirm', 'confirm']","[]","Relation"
"high voltage connector","single connector","kept","['retained', 'maintained', 'kept', 'preserved', 'held']","[]","Relation"
"mini display port","labelling","labelled","['designated', 'marked', 'tagged', 'labeled', 'identified']","[]","Relation"
"ribbing","transport frame","added","['enlarged', 'increased', 'augmented']","[]","Relation"
"injection moulding company","ribbing","optimised","['perfected', 'enhanced', 'refined', 'improved', 'maximized']","[]","Relation"
"The minutes of the Strip Module Meeting were taken on 11/02/20.","Actions were carried over at the meeting.","at the same time","['happen together', 'coexist', 'overlap', 'coincide', 'synchronize']","[]","Relation"
"Actions were carried over.","The responsible personnel were contacted periodically by Craig & Ingo for updates.","before","['earlier', 'prior', 'precede', 'lead', 'precedes']","[]","Relation"
"The responsible personnel were contacted periodically by Craig & Ingo for updates.","They were listed as responsible in the meeting.","because","['owing to', 'thanks to', 'as a result of', 'due to']","[]","Relation"
"The meeting was introduced by Craig & Ingo.","Nothing was reported from the introduction.","at the same time","['happen together', 'coexist', 'overlap', 'coincide', 'synchronize']","[]","Relation"
"Nothing was reported from the introduction.","Satish discussed the DCDC coils.","at the same time","['happen together', 'coexist', 'overlap', 'coincide', 'synchronize']","[]","Relation"
"Satish discussed the DCDC coils.","The QC boundaries of the coils were questioned from a powerboard performance point of view.","because","['owing to', 'thanks to', 'as a result of', 'due to']","[]","Relation"
"The QC boundaries of the coils were questioned from a powerboard performance point of view.","The specs defined for the coils were not led by ATLAS performance specs.","because","['owing to', 'thanks to', 'as a result of', 'due to']","[]","Relation"
"The specs defined for the coils were not led by ATLAS performance specs.","The specs were defined more by what is possible with available wire.","because","['owing to', 'thanks to', 'as a result of', 'due to']","[]","Relation"
"10 samples from each 1/50 of production were tested.","Satish questioned the QC boundaries of the coils.","because","['owing to', 'thanks to', 'as a result of', 'due to']","[]","Relation"
"500 coils in total were planned to be tested.","10 samples from each 1/50 of production were tested.","because","['owing to', 'thanks to', 'as a result of', 'due to']","[]","Relation"
"The quantity of coils was evaluated by EC 10,000.","The risk of yield numbers changing slightly was considered.","because","['owing to', 'thanks to', 'as a result of', 'due to']","[]","Relation"
"The quantity of coils was evaluated by EC 10,000.","16,000 for barrel makes sense to Dennis but looks like overhead is slightly different.","at the same time","['happen together', 'coexist', 'overlap', 'coincide', 'synchronize']","[]","Relation"
"The quantity of coils was evaluated by EC 10,000.","The risk of yield numbers changing slightly is why typically PRR is the point that large numbers get bought.","at the same time","['happen together', 'coexist', 'overlap', 'coincide', 'synchronize']","[]","Relation"
"The risk of yield numbers changing slightly is why typically PRR is the point that large numbers get bought.","It is an understood risk to buy everything now.","because","['owing to', 'thanks to', 'as a result of', 'due to']","[]","Relation"
"The status of powerboard test crate was discussed.","The introduction by Craig & Ingo was completed.","after","['later', 'afterwards', 'next', 'afterward', 'follow']","[]","Relation"
"The barrel module frame and hybrid panel finalisation was discussed.","Clearance on module transport frame for RFID was questioned.","at the same time","['happen together', 'coexist', 'overlap', 'coincide', 'synchronize']","[]","Relation"
"Clearance on module transport frame for RFID was questioned.","The clearance was potentially at risk.","because","['owing to', 'thanks to', 'as a result of', 'due to']","[]","Relation"
"The module transport frame for RFID should be okay.","Clearance was questioned on the module transport frame for RFID.","because","['owing to', 'thanks to', 'as a result of', 'due to']","[]","Relation"
"Craig and Ash will iterate to make sure everything fits together.","The clearance on module transport frame for RFID was questioned.","because","['owing to', 'thanks to', 'as a result of', 'due to']","[]","Relation"
"It could be tricky to keep track of all the diodes when placing the sensor/module in the frame.","The diodes need to be placed carefully in the frame.","because","['owing to', 'thanks to', 'as a result of', 'due to']","[]","Relation"
"Removing the diodes along one side or the other could be an option.","It could be tricky to keep track of all the diodes when placing the sensor/module in the frame.","because","['owing to', 'thanks to', 'as a result of', 'due to']","[]","Relation"
"Gerrit likes the security of all 4 sides.","He prefers to keep the diodes on all four sides of the frame.","because","['owing to', 'thanks to', 'as a result of', 'due to']","[]","Relation"
"The high voltage connector could be changed to be on a separate connector.","It could improve safety and compatibility.","because","['owing to', 'thanks to', 'as a result of', 'due to']","[]","Relation"
"The pros of keeping the single connector were discussed.","The high voltage connector could be changed to be on a separate connector.","because","['owing to', 'thanks to', 'as a result of', 'due to']","[]","Relation"
"The cons of keeping the single connector were discussed.","The high voltage connector could be changed to be on a separate connector.","because","['owing to', 'thanks to', 'as a result of', 'due to']","[]","Relation"
"Labels for the mini display port were provided on the transport frames.","Labels to be included on the PCB silk screen in case of running without transport frame in place.","at the same time","['happen together', 'coexist', 'overlap', 'coincide', 'synchronize']","[]","Relation"
"Ribbing was added to the barrel transport frame.","The injection moulding company optimised the ribbing.","before","['earlier', 'prior', 'precede', 'lead', 'precedes']","[]","Relation"
"Craig & Ingo gave an introduction for the meeting.","Craig","is participated by","['host', 'feature', 'have', 'sponsor']","[]","Relation"
"Craig & Ingo gave an introduction for the meeting.","Ingo","is participated by","['host', 'feature', 'have', 'sponsor']","[]","Relation"
"Satish discussed the DCDC coils.","Satish","is participated by","['host', 'feature', 'have', 'sponsor']","[]","Relation"
"The quantity of DCDC coils was evaluated.","EC","is participated by","['host', 'feature', 'have', 'sponsor']","[]","Relation"
"The quantity of DCDC coils was evaluated.","production management","is participated by","['host', 'feature', 'have', 'sponsor']","[]","Relation"
"Christian gave a status update on the powerboard test crate.","Christian","is participated by","['host', 'feature', 'have', 'sponsor']","[]","Relation"
"Sven discussed the barrel module frame and hybrid panel finalisation.","Sven","is participated by","['host', 'feature', 'have', 'sponsor']","[]","Relation"
"The high voltage connector for the barrel module frame and hybrid panel was discussed.","Sven","is participated by","['host', 'feature', 'have', 'sponsor']","[]","Relation"
"The high voltage connector for the barrel module frame and hybrid panel was discussed.","Craig","is participated by","['host', 'feature', 'have', 'sponsor']","[]","Relation"
"The high voltage connector for the barrel module frame and hybrid panel was discussed.","Ash","is participated by","['host', 'feature', 'have', 'sponsor']","[]","Relation"
"The high voltage connector for the barrel module frame and hybrid panel was discussed.","Gerrit","is participated by","['host', 'feature', 'have', 'sponsor']","[]","Relation"
"The mini display port labelling for the barrel module frame and hybrid panel was discussed.","Sven","is participated by","['host', 'feature', 'have', 'sponsor']","[]","Relation"
"The mini display port labelling for the barrel module frame and hybrid panel was discussed.","Craig","is participated by","['host', 'feature', 'have', 'sponsor']","[]","Relation"
"The mini display port labelling for the barrel module frame and hybrid panel was discussed.","Ash","is participated by","['host', 'feature', 'have', 'sponsor']","[]","Relation"
"The mini display port labelling for the barrel module frame and hybrid panel was discussed.","Gerrit","is participated by","['host', 'feature', 'have', 'sponsor']","[]","Relation"
"Gerrit discussed the barrel transport frame.","Gerrit","is participated by","['host', 'feature', 'have', 'sponsor']","[]","Relation"
"The ribbing on the barrel transport frame was optimised.","injection moulding company","is participated by","['host', 'feature', 'have', 'sponsor']","[]","Relation"
"The risk of yield numbers changing slightly was discussed.","Dennis","is participated by","['host', 'feature', 'have', 'sponsor']","[]","Relation"
"The risk of yield numbers changing slightly was discussed.","production management","is participated by","['host', 'feature', 'have', 'sponsor']","[]","Relation"
"The ATLAS performance specs were mentioned.","ATLAS","is participated by","['host', 'feature', 'have', 'sponsor']","[]","Relation"
"The quantity of samples for testing was discussed.","Satish","is participated by","['host', 'feature', 'have', 'sponsor']","[]","Relation"
"The quantity of samples for testing was discussed.","EC","is participated by","['host', 'feature', 'have', 'sponsor']","[]","Relation"
"The powerboard performance was discussed.","Satish","is participated by","['host', 'feature', 'have', 'sponsor']","[]","Relation"
"The QC boundaries for the DCDC coils were discussed.","Satish","is participated by","['host', 'feature', 'have', 'sponsor']","[]","Relation"
"The people listed as responsible will be contacted periodically.","Craig","is participated by","['host', 'feature', 'have', 'sponsor']","[]","Relation"
"The people listed as responsible will be contacted periodically.","Ingo","is participated by","['host', 'feature', 'have', 'sponsor']","[]","Relation"
"The action items for the meeting were listed.","Craig","is participated by","['host', 'feature', 'have', 'sponsor']","[]","Relation"
"The action items for the meeting were listed.","Ingo","is participated by","['host', 'feature', 'have', 'sponsor']","[]","Relation"
"Craig","transport frame","forgot","['forget', 'overlook', 'lose track', 'neglect', 'misremember']","[]","Relation"
"suction cups","assembly","help","['assist', 'relieve', 'aid', 'support', 'lend a hand']","[]","Relation"
"suction cups","surface","stick","['adhere', 'cling', 'stick', 'attach', 'join', 'bond']","[]","Relation"
"DI water","surface","makes","['create', 'manufactures', 'generates', 'produces']","[]","Relation"
"isoprop","surface","makes","['create', 'manufactures', 'generates', 'produces']","[]","Relation"
"humidity indicators","box","use","['employ', 'utilize', 'apply', 'adopt']","[]","Relation"
"dessicant","box","use","['employ', 'utilize', 'apply', 'adopt']","[]","Relation"
